,username,user_handle,date,retweets,favorites,text,geological_location,mentions,hashtags,tweet_id,permalink
1136,Greenpeace UK,GreenpeaceUK,2017-12-12 14:17,193,229,"Woah! AXA - the world's third-biggest insurance company, has just announced that it's divesting €2,4bln from coal and €700 mln from tar sands because of their climate and human rights impacts. Retweet to celebrate! https://www.theguardian.com/environment/2017/dec/12/insurance-giant-axa-dumps-investments-tar-sands-pipelines …",,,,9.405561566107689e+17,https://twitter.com/GreenpeaceUK/status/940556156610768896
1137,Greenpeace UK,GreenpeaceUK,2017-11-08 17:30,48,57,"Trump stands alone. Syria is joining the Paris Climate Agreement, making the US the only country in the world to not support the accord. RT pic.twitter.com/wmYMuU1Tux",,,,9.282834714952212e+17,https://twitter.com/GreenpeaceUK/status/928283471495221248
1138,Greenpeace UK,GreenpeaceUK,2017-11-01 12:45,34,82,“I cannot bear to stand by and watch our wonderful natural world be irreversibly damaged by climate change.” # FrackingOnTrialpic.twitter.com/ANDE6Ve3y3,,,#,9.256750374026772e+17,https://twitter.com/GreenpeaceUK/status/925675037402677249
1139,Greenpeace UK,GreenpeaceUK,2017-10-31 15:51,221,223,Climate change is leading to extreme weather events. We should NOT be drilling for new oil. Sign the petition >> http://act.gp/2zUtqWT pic.twitter.com/HxOW7KB4Qi,,,,9.2535969441536e+17,https://twitter.com/GreenpeaceUK/status/925359694415360001
1140,Greenpeace UK,GreenpeaceUK,2017-09-17 12:08,58,99,The Pentagon is moving ahead with an Obama-era climate plan despite Trump's orders. http://bit.ly/2y1K0Db,,,,9.093431678996685e+17,https://twitter.com/GreenpeaceUK/status/909343167899668480
1141,Greenpeace UK,GreenpeaceUK,2017-08-10 21:48,51,47,Al Gore's new film about climate change is being shown across the UK in the next few weeks http://www.empireonline.com/movies/incovenient-sequel-truth-power/review/ …,,,,8.957183939988275e+17,https://twitter.com/GreenpeaceUK/status/895718393998827520
1142,Greenpeace UK,GreenpeaceUK,2017-07-26 14:11,182,109,Car companies already willingly giving up # diesel and # petrol. Our health & the climate simply cannot wait until 2040. RT if you agree pic.twitter.com/jDPw6GY8hH,,,# #,8.901677838493286e+17,https://twitter.com/GreenpeaceUK/status/890167783849328640
1143,Greenpeace UK,GreenpeaceUK,2017-07-25 11:06,191,274,The dangers of climate change are clear. There's no time to waste! pic.twitter.com/IahDNFMJQB,,,,8.897586193354998e+17,https://twitter.com/GreenpeaceUK/status/889758619335499776
1144,Greenpeace UK,GreenpeaceUK,2017-07-14 13:58,85,92,In Lancashire to support locals who've spent years saying NO to fracking. SO inspired by these amazing climate protectors! RT if you are too pic.twitter.com/u8HGKucgli,,,,8.858158065123041e+17,https://twitter.com/GreenpeaceUK/status/885815806512304130
1145,Greenpeace UK,GreenpeaceUK,2017-06-29 13:13,107,69,RT if you think this has to change: @ guardian reveal that world's plastic binge 'as dangerous as climate change' http://bit.ly/2t0AH4W pic.twitter.com/G0ET5b7cSs,,@,,8.803684967309435e+17,https://twitter.com/GreenpeaceUK/status/880368496730943490
1146,Greenpeace UK,GreenpeaceUK,2017-06-21 14:05,29,58,Great news. @ theresa_may commits to support international action against climate change & implement Paris Agreement in # QueensSpeechpic.twitter.com/qgcuKUgNgv,,@,#,8.774826007299072e+17,https://twitter.com/GreenpeaceUK/status/877482600729907200
1147,Greenpeace UK,GreenpeaceUK,2017-06-13 13:19,56,115,"Defying Trump, Hawaii Becomes First State to Pass Law Committing to Paris Climate Accord https://nyti.ms/2sToP3t pic.twitter.com/jFdnA1C6PC",,,,8.745719416670577e+17,https://twitter.com/GreenpeaceUK/status/874571941667057665
1148,Greenpeace UK,GreenpeaceUK,2017-06-01 22:55,455,705,"With most British ppl concerned about climate change, Theresa May must publicly distance herself from Trump’s move to quit # ParisClimateDeal",,,#,8.703681820491407e+17,https://twitter.com/GreenpeaceUK/status/870368182049140736
1149,Greenpeace UK,GreenpeaceUK,2017-05-26 13:29,60,90,Wow! a whopping 84% of Brits want @ theresa_may to have a word with Donald Trump about climate change. More here: http://www.independent.co.uk/environment/climate-change-theresa-may-donald-trump-paris-agreement-global-warming-84-per-cent-britons-a7755106.html …,,@,,8.680513924134339e+17,https://twitter.com/GreenpeaceUK/status/868051392413433856
1150,Greenpeace UK,GreenpeaceUK,2017-05-17 17:59,85,69,"If France, Germany, Japan, China and other countries can stand up to Donald Trump & defend the Paris climate Deal, why Can't @ theresa_may?!pic.twitter.com/4AIDXurJHG",,@,,8.64857919396905e+17,https://twitter.com/GreenpeaceUK/status/864857919396904960
1151,Greenpeace UK,GreenpeaceUK,2017-05-09 15:07,234,301,President-Elect Macron has used his first phone call with Donald Trump to defend the Paris Climate Deal. Why can't @ theresa_may do the same?pic.twitter.com/3AEWAiBqS6,,@,,8.619154209237484e+17,https://twitter.com/GreenpeaceUK/status/861915420923748352
1152,Greenpeace UK,GreenpeaceUK,2017-05-07 00:44,55,49,Our campaign to stop Donald Trump wrecking the Paris climate deal features in tomorrow's Observer. Read it here: https://www.theguardian.com/environment/2017/may/06/theresa-may-donald-trump-paris-climate-accord …,,,,8.609734858285711e+17,https://twitter.com/GreenpeaceUK/status/860973485828571137
1153,Greenpeace UK,GreenpeaceUK,2017-05-05 10:43,97,68,Urgent! Right now Trump is deciding whether or not to pull the US out of the Paris climate deal. Take action now: http://act.gp/2pMuyHW pic.twitter.com/yM2eoDJidq,,,,8.603996161221222e+17,https://twitter.com/GreenpeaceUK/status/860399616122122240
1154,Greenpeace UK,GreenpeaceUK,2017-04-04 20:11,162,239,"Nicola Sturgeon won't meet @ realDonaldTrump while in USA, she'll sign agreement on climate change with Trump critic http://bit.ly/2nXQ39y pic.twitter.com/5g5Wbbrzpy",,@,,8.493083334502482e+17,https://twitter.com/GreenpeaceUK/status/849308333450248192
1155,Greenpeace UK,GreenpeaceUK,2017-03-20 23:07,145,188,Stephen Hawking's message for Trump: don't ignore climate change - it's one of the greatest dangers we face http://mashable.com/2017/03/19/stephen-hawking-trump-science-immigration/ …,,,,8.439320135435264e+17,https://twitter.com/GreenpeaceUK/status/843932013543526402
1156,Greenpeace UK,GreenpeaceUK,2017-03-19 13:40,157,59,7 Shocking Photos Reveal What 100 Years Of Climate Change Has Done To Arctic Glaciers http://bit.ly/2mMh1yA pic.twitter.com/PapagfVddA,,,,8.434268278131016e+17,https://twitter.com/GreenpeaceUK/status/843426827813101568
1157,Greenpeace UK,GreenpeaceUK,2017-03-18 17:42,91,45,Breaking: US 'forces G20 to drop any mention of climate change' in joint statement http://www.independent.co.uk/news/world/politics/g20-finance-ministers-statement-climate-change-fair-trade-trump-a7636956.html …,,,,8.431255617026949e+17,https://twitter.com/GreenpeaceUK/status/843125561702694915
1158,Greenpeace UK,GreenpeaceUK,2017-03-10 17:26,42,18,Researchers believe a spike in methane emissions (that will only fuel climate change more) is linked to US fracking http://www.climatecentral.org/news/us-60-percent-of-global-methane-growth-20037 …,,,,8.402223524577608e+17,https://twitter.com/GreenpeaceUK/status/840222352457760770
1159,Greenpeace UK,GreenpeaceUK,2017-02-15 20:22,22,15,Trump's likely science adviser calls climate scientists 'glassy-eyed cult' http://bit.ly/2kqxpHh pic.twitter.com/SWr2lnDvff,,,,8.31931586035798e+17,https://twitter.com/GreenpeaceUK/status/831931586035798016
1160,Greenpeace UK,GreenpeaceUK,2017-02-12 18:44,45,40,20+ Powerful Street Art Pieces That Tell The Uncomfortable Truth About Climate Change http://bit.ly/1NBq2Vt pic.twitter.com/mexJw90ASN,,,,8.308197573811364e+17,https://twitter.com/GreenpeaceUK/status/830819757381136385
1161,Greenpeace UK,GreenpeaceUK,2017-02-01 22:27,26,27,Breaking: Oil Exec Rex Tillerson - who helped deny climate change for decades - confirmed as US Secretary of State. We must # ResistOftenpic.twitter.com/PAXJwmUhAd,,,#,8.268897079886111e+17,https://twitter.com/GreenpeaceUK/status/826889707988611072
1162,Greenpeace UK,GreenpeaceUK,2017-01-25 13:28,91,113,Donald Trump bans officials from tweeting on climate change - but one national park spoke out anyway! http://cbsn.ws/2juApxS,,,,8.242173501237494e+17,https://twitter.com/GreenpeaceUK/status/824217350123749377
1163,Greenpeace UK,GreenpeaceUK,2017-01-19 12:33,20,20,. @ guardian is live reporting how climate change is already impacting people & the planet. Worth a look https://www.theguardian.com/environment/live/2017/jan/19/global-warning-live-from-the-climate-change-frontline-as-trump-becomes-president …,,@,,8.220292160111862e+17,https://twitter.com/GreenpeaceUK/status/822029216011186176
1164,Greenpeace UK,GreenpeaceUK,2017-01-18 18:20,27,18,BREAKING: 2016 officially the hottest year on record. @ realDonaldTrump - you ready to tackle climate change yet? http://bit.ly/2jKYGQz,,@,,8.217541985178419e+17,https://twitter.com/GreenpeaceUK/status/821754198517841920
1165,Greenpeace UK,GreenpeaceUK,2017-01-18 15:36,30,41,Great news for the climate! China just announced it will suspended plans to build more than 100 coal power plants http://energydesk.greenpeace.org/2017/01/16/china-coal-power-overcapacity-crackdown/ …,,,,8.217127486817649e+17,https://twitter.com/GreenpeaceUK/status/821712748681764868
1166,Greenpeace UK,GreenpeaceUK,2016-12-26 14:37,41,64,When @ LeoDiCaprio won an Oscar & spoke up about climate change - is one of our favourite positive stories of 2016. http://bit.ly/2iaMasR pic.twitter.com/1Gdvc7HmNP,,@,,8.133629820214518e+17,https://twitter.com/GreenpeaceUK/status/813362982021451776
1167,Greenpeace UK,GreenpeaceUK,2016-12-16 14:48,33,10,Our investigations team has exposed @ centricaplc donations to climate denying think tank linked to Trump. Full story http://energydesk.greenpeace.org/2016/12/15/british-gas-centrica-donates-climate-denial-linked-trump/ …pic.twitter.com/BZp5n0R1ET,,@,,8.097419013855805e+17,https://twitter.com/GreenpeaceUK/status/809741901385580544
1168,Greenpeace UK,GreenpeaceUK,2016-12-12 16:42,59,43,# Exxon knew about climate change in 1970s yet fuelled climate denial - now their CEO could be US sec of state http://bit.ly/2hyAUFH pic.twitter.com/AbUHrxueZf,,,#,8.083210093591347e+17,https://twitter.com/GreenpeaceUK/status/808321009359134720
1169,Greenpeace UK,GreenpeaceUK,2016-11-26 20:25,74,31,The Committee on Climate Change says the business plan for Heathrow projects a 15% increase in aviation: http://bbc.in/2fywwrX pic.twitter.com/ZyCjgoPwAG,,,,8.025789216779305e+17,https://twitter.com/GreenpeaceUK/status/802578921677930497
1170,Greenpeace UK,GreenpeaceUK,2016-11-18 13:46,261,324,"128,247 people told the UK government to hurry up and sign the Paris Climate Deal. Great news - They finally did! Retweet to celebrate pic.twitter.com/XDleYAZpqE",,,,7.995795659202396e+17,https://twitter.com/GreenpeaceUK/status/799579565920239616
1171,Greenpeace UK,GreenpeaceUK,2016-11-18 13:10,165,134,Great News! The UK has finally ratified the Paris Climate Deal! Retweet to celebrate! https://www.theguardian.com/environment/2016/nov/17/uk-boris-johnson-ratifies-paris-climate-agreement?CMP=share_btn_link …,,,,7.99570494794113e+17,https://twitter.com/GreenpeaceUK/status/799570494794113024
1172,Greenpeace UK,GreenpeaceUK,2016-11-12 14:22,35,64,Phew: Australia won't follow Trump's lead on Paris climate agreement http://bit.ly/2fWRqDy pic.twitter.com/yf1l2zlYJS,,,,7.974141388550308e+17,https://twitter.com/GreenpeaceUK/status/797414138855030788
1173,Greenpeace UK,GreenpeaceUK,2016-11-11 19:20,28,26,Trump presidency a 'disaster for the planet' warn leading climate scientists http://bit.ly/2fHo0rK pic.twitter.com/nPBcwO5mDt,,,,7.971267478630523e+17,https://twitter.com/GreenpeaceUK/status/797126747863052288
1174,Greenpeace UK,GreenpeaceUK,2016-11-11 17:14,48,52,Need some good news?! Kids Suing the US Federal Government to Demand Climate Action Just Had A Victory: http://ti.me/2eo9Z2o pic.twitter.com/sxrCIge5qj,,,,7.970950362444882e+17,https://twitter.com/GreenpeaceUK/status/797095036244488192
1175,Greenpeace UK,GreenpeaceUK,2016-11-10 12:00,81,98,"We must be unite against hate, bigotry and climate denial. One foot in front of the other. # ThursdayThoughtspic.twitter.com/jdHA5IuZqU",,,#,7.966536305773978e+17,https://twitter.com/GreenpeaceUK/status/796653630577397761
1176,Greenpeace UK,GreenpeaceUK,2016-11-09 15:16,101,163,"Now, it’s more important than ever that we unite to fight against hate, bigotry, and climate denial. Onward. @ greenpeaceusa # lovetrumpshatepic.twitter.com/Htd3C3wZ0T",,@,#,7.96340601532928e+17,https://twitter.com/GreenpeaceUK/status/796340601532928000
1177,Greenpeace UK,GreenpeaceUK,2016-11-08 16:31,26,27,"The UN's climate change conference, # COP22, is taking place this week. We're calling on leaders to embrace solar energy # SunUnitesUspic.twitter.com/RXmZBpvWqN",,,# #,7.959970562298962e+17,https://twitter.com/GreenpeaceUK/status/795997056229896194
1178,Greenpeace UK,GreenpeaceUK,2016-11-04 17:20,52,39,World's biggest oil firms announce plan to invest basically no money in tackling climate change http://energydesk.greenpeace.org/2016/11/04/factcheck-oil-firms-announce-going-invest-basically-no-money-tackling-climate-change/ …pic.twitter.com/71Pj2NEe53,,,,7.945598340749066e+17,https://twitter.com/GreenpeaceUK/status/794559834074906627
1179,Greenpeace UK,GreenpeaceUK,2016-10-30 21:05,52,51,Watch @ LeoDiCaprio's new climate change film # BeforetheFlood tonight on @ NatGeoChannel at 9pm or stream for free >> http://beforetheflood.com pic.twitter.com/ZvQ2cGU4hk,,@ @,#,7.92804518798893e+17,https://twitter.com/GreenpeaceUK/status/792804518798893058
1180,Greenpeace UK,GreenpeaceUK,2016-10-25 13:33,202,91,"BREAKING: Committee chaired by @ theresa_may approves 3rd runway at # Heathrow, despite # Paris climate agreement. pic.twitter.com/TlOCSOoyWE",,@,# #,7.908638396298322e+17,https://twitter.com/GreenpeaceUK/status/790863839629832192
1181,Greenpeace UK,GreenpeaceUK,2016-10-09 14:02,244,251,"Climate change is real, and we don't have time to argue about it. RT if you agree with @ LeoDiCaprio & 97% of scientists.pic.twitter.com/uJiNn1hGnX",,@,,7.850729590735094e+17,https://twitter.com/GreenpeaceUK/status/785072959073509376
1182,Greenpeace UK,GreenpeaceUK,2016-10-06 14:08,235,113,"Erm, is this what fighting climate change looks like? # DontFrackLancspic.twitter.com/dMTICUE70t",,,#,7.839872212212408e+17,https://twitter.com/GreenpeaceUK/status/783987221221240832
1183,Greenpeace UK,GreenpeaceUK,2016-10-06 13:40,63,23,"While rest of the world is signing Paris climate deal, UK govt has just announced it'll burn more fossil fuels http://energydesk.greenpeace.org/2016/10/06/climate-world-ratifies-paris-uk-approves-fracking/ …",,,,7.839802514540708e+17,https://twitter.com/GreenpeaceUK/status/783980251454070784
1184,Greenpeace UK,GreenpeaceUK,2016-10-06 11:47,96,69,BREAKING! we now have a fully ratified climate agreement. It's now time to put words into climate action. Retweet to celebrate! pic.twitter.com/Ut4TNPypAQ,,,,7.839518139344814e+17,https://twitter.com/GreenpeaceUK/status/783951813934481408
1185,Greenpeace UK,GreenpeaceUK,2016-10-03 13:09,50,56,"Great news! India, one of world's largest greenhouse gas emitters, has ratified the Paris global climate agreement http://www.bbc.co.uk/news/world-asia-india-37536348 …",,,,7.828853032457626e+17,https://twitter.com/GreenpeaceUK/status/782885303245762560
1186,Greenpeace UK,GreenpeaceUK,2016-10-01 16:58,53,59,Happy # WorldVegetarianDay - Will vegetarianism solve climate change?! This blog explains: http://bit.ly/25cfjJY pic.twitter.com/VjFqNFit1E,,,#,7.822181771199406e+17,https://twitter.com/GreenpeaceUK/status/782218177119940609
1187,Greenpeace UK,GreenpeaceUK,2016-09-22 12:06,305,227,"375 top scientists warn of 'real, serious, immediate' climate threat >> http://bit.ly/2cZBjSJ pic.twitter.com/iIkcCum58b",,,,7.788831791093473e+17,https://twitter.com/GreenpeaceUK/status/778883179109347329
1188,Greenpeace UK,GreenpeaceUK,2016-09-21 15:43,145,124,Good News! @ theresa_may has pledged to the UN that the UK will ratify the Paris Climate Deal by the end of 2016. Retweet to celebrate! pic.twitter.com/YJTj7KbCnv,,@,,7.785754093949379e+17,https://twitter.com/GreenpeaceUK/status/778575409394937861
1189,Greenpeace UK,GreenpeaceUK,2016-09-13 16:46,56,22,Brazil has now ratified the Paris Climate Deal. @ theresa_may 's govt still hasn't >> https://www.theguardian.com/environment/2016/sep/13/brazil-ratifies-paris-agreement-with-pledge-to-sharply-reduce-emissions …pic.twitter.com/KbPZ4ISY6B,,@,,7.756921753382461e+17,https://twitter.com/GreenpeaceUK/status/775692175338246145
1190,Greenpeace UK,GreenpeaceUK,2016-09-08 15:22,38,34,Government today committed extra £ for floods. But MORE is needed as climate change worsens http://bbc.in/2claWYC pic.twitter.com/kRbxrqnW1g,,,,7.738589815886561e+17,https://twitter.com/GreenpeaceUK/status/773858981588656128
1191,Greenpeace UK,GreenpeaceUK,2016-09-07 15:55,55,31,"PM says UK will ratify the Paris climate deal, but actions speak louder than words # PMQs http://bit.ly/2cBsRts pic.twitter.com/JE7JIyr2MG",,,#,7.735050723366707e+17,https://twitter.com/GreenpeaceUK/status/773505072336670720
1192,Greenpeace UK,GreenpeaceUK,2016-09-02 18:33,28,26,30 worldwide mayors including @ SadiqKhan call for the ratification of Paris climate deal http://bit.ly/2bHTckE pic.twitter.com/PlPZ4I7dko,,@,,7.71732716257579e+17,https://twitter.com/GreenpeaceUK/status/771732716257579008
1193,Greenpeace UK,GreenpeaceUK,2016-08-27 15:00,64,32,"Only 90 companies are to blame for most climate change, this 'carbon accountant' says http://bit.ly/2bQpDiq pic.twitter.com/XpIwJ62nmr",,,,7.695048206254858e+17,https://twitter.com/GreenpeaceUK/status/769504820625485828
1194,Greenpeace UK,GreenpeaceUK,2016-08-18 12:28,29,22,“Any minute I’m not talking about climate change I’m turning my back on the most important thing happening to us” http://bit.ly/2bf0G1B,,,,7.662049946431939e+17,https://twitter.com/GreenpeaceUK/status/766204994643193856
1195,Greenpeace UK,GreenpeaceUK,2016-08-09 12:54,101,106,It's # IndigenousPeoplesDay. 4 stories of their struggle for climate justice >> http://www.greenpeace.org.uk/blog/climate/4-stories-indigenous-peoples …pic.twitter.com/pmkojkkj3k,,,#,7.629501284623565e+17,https://twitter.com/GreenpeaceUK/status/762950128462356480
1196,Greenpeace UK,GreenpeaceUK,2016-07-27 14:13,535,480,When it's the 14 consecutive month of record-breaking temperatures & the climate change department has been scrapped pic.twitter.com/wPjYKIKUVv,,,,7.582591223746068e+17,https://twitter.com/GreenpeaceUK/status/758259122374606848
1197,Greenpeace UK,GreenpeaceUK,2016-07-21 13:15,25,34,REVEALED: Vatican Bank officials didn't get @ Pontifex's memo on climate change http://bit.ly/2a5uIES pic.twitter.com/PwbEYGm6b0,,@,,7.560701216224297e+17,https://twitter.com/GreenpeaceUK/status/756070121622429696
1199,Greenpeace UK,GreenpeaceUK,2016-06-28 12:06,24,22,From melting sea ice to coral reef bleaching... 7 climate records set so far in 2016 >> http://bit.ly/267GzXc,,,,7.477177993347768e+17,https://twitter.com/GreenpeaceUK/status/747717799334776833
1200,Greenpeace UK,GreenpeaceUK,2016-06-21 18:39,48,33,"No time to waste."" Maldives urges rich countries to rapidly ratify Paris climate agreement: http://bit.ly/28KBcop pic.twitter.com/99b2M2Tzye""",,,,7.452798877291028e+17,https://twitter.com/GreenpeaceUK/status/745279887729102849
1201,Greenpeace UK,GreenpeaceUK,2016-06-19 12:03,54,21,"Shattered records show climate change is an emergency today, scientists warn >> http://bit.ly/1tu9S7T",,,,7.444554424876646e+17,https://twitter.com/GreenpeaceUK/status/744455442487664640
1202,Greenpeace UK,GreenpeaceUK,2016-06-17 18:59,26,27,Norway pledges to become climate neutral by 2030 >> http://bit.ly/239lv0H,,,,7.438353894970491e+17,https://twitter.com/GreenpeaceUK/status/743835389497049088
1203,Greenpeace UK,GreenpeaceUK,2016-05-19 15:54,157,142,Watch: Our # sunkencities banner drop at @ britishmuseum. Each banner names a place at risk frm climate change # DropBPpic.twitter.com/BslRf8qhJ1,,@,# #,7.332796150792888e+17,https://twitter.com/GreenpeaceUK/status/733279615079288832
1204,Greenpeace UK,GreenpeaceUK,2016-05-19 15:05,38,32,Climate-wreckers BP sponsoring exhibit about # sunkencities. Tell @ britishmuseum to drop them http://bit.ly/1XmHFLq pic.twitter.com/LtPgZ7hUK8,,@,#,7.332672694390866e+17,https://twitter.com/GreenpeaceUK/status/733267269439086592
1205,Greenpeace UK,GreenpeaceUK,2016-05-19 14:21,64,58,"Banners dropped at @ BP_plc sponsored # SunkenCities name real sunken cities hit by climate change, like New Orleans pic.twitter.com/sTvIet0Tb6",,@,#,7.332562903492731e+17,https://twitter.com/GreenpeaceUK/status/733256290349273088
1206,Greenpeace UK,GreenpeaceUK,2016-05-03 18:52,40,22,REVEALED: Climate protection appears absent from # TTIP -have we forgotten Paris? # TTIPLeaks http://bit.ly/TTIPleaksnl pic.twitter.com/knzHaZvXum,,,# #,7.275263767235994e+17,https://twitter.com/GreenpeaceUK/status/727526376723599360
1207,Greenpeace UK,GreenpeaceUK,2016-04-27 17:04,56,60,"Emma Thompson & these locals know that to tackle climate change we need renewables, NOT new fossil fuels # BakeOffpic.twitter.com/EmiLQPkfbe",,,#,7.253247339658199e+17,https://twitter.com/GreenpeaceUK/status/725324733965819905
1208,Greenpeace UK,GreenpeaceUK,2016-04-23 14:53,24,30,Some good news for the weekend: Yesterday 170+ countries signed the Paris climate agreement http://www.theguardian.com/environment/paris-climate-agreement …pic.twitter.com/NCiFca9jDi,,,,7.238423001918792e+17,https://twitter.com/GreenpeaceUK/status/723842300191879168
1209,Greenpeace UK,GreenpeaceUK,2016-04-08 11:34,30,31,"Reducing food waste would mitigate climate change, says study >> http://bit.ly/1YipSn9 # WasteNotpic.twitter.com/CtXJlgJElV",,,#,7.18356312787198e+17,https://twitter.com/GreenpeaceUK/status/718356312787197954
1210,Greenpeace UK,GreenpeaceUK,2016-04-07 13:37,39,22,One Fact About Climate Change That’s Worth Repeating >> http://bit.ly/1MTGaC7 pic.twitter.com/YvZ7btODem,,,,7.180247880531313e+17,https://twitter.com/GreenpeaceUK/status/718024788053131264
1211,Greenpeace UK,GreenpeaceUK,2016-03-30 16:25,79,35,We've no choice but to expose this climate crisis ourselves. Hit share now: https://indonesiaburning.com pic.twitter.com/HGCagOg84G,,,,7.151680344287314e+17,https://twitter.com/GreenpeaceUK/status/715168034428731392
1212,Greenpeace UK,GreenpeaceUK,2016-03-25 14:47,43,53,ICYMI: Fiji has become the 1st country to ratify the climate deal made in Paris last year http://bit.ly/1TiXFvZ pic.twitter.com/RY0O6LKAH2,,,,7.133464665724682e+17,https://twitter.com/GreenpeaceUK/status/713346466572468226
1213,Greenpeace UK,GreenpeaceUK,2016-03-16 22:28,114,65,. @ George_Osborne: ' # Budget2016 is for for our children' Children: 'But you just gave tax cuts to climate wreckers' pic.twitter.com/JZGIkS4Eq1,,@,#,7.102010767508808e+17,https://twitter.com/GreenpeaceUK/status/710201076750880770
1214,Greenpeace UK,GreenpeaceUK,2016-03-10 20:06,32,39,"When teenagers started taking govts to court over climate change, people laughed at them... http://www.goldcoastbulletin.com.au/news/world/young-people-are-suing-governments-over-climate-change/news-story/e327a797ab048ba2013f7f96c2d3ffbc …pic.twitter.com/FPju3rFLXh",,,,7.07991109381845e+17,https://twitter.com/GreenpeaceUK/status/707991109381844992
1215,Greenpeace UK,GreenpeaceUK,2016-02-29 08:58,91,97,How's this for # mondaymotivation?! RT if you want urgent action on climate change like @ LeoDiCaprio. # Oscarspic.twitter.com/ER9vZx9iSU,,@,# #,7.041990418113905e+17,https://twitter.com/GreenpeaceUK/status/704199041811390464
1216,Greenpeace UK,GreenpeaceUK,2016-02-29 08:27,188,243,When you *finally* win an Oscar and use your speech to talk about climate action... # Oscars @ LeoDiCapriopic.twitter.com/XAPAKpENUc,,@,#,7.041913631103263e+17,https://twitter.com/GreenpeaceUK/status/704191363110326272
1217,Greenpeace UK,GreenpeaceUK,2016-02-29 08:15,240,285,Woohoo! @ LeoDiCaprio finally won an Oscar. He used his speech to highlight the need for urgent climate action <3 pic.twitter.com/jd2rEQEkxk,,@,,7.041883203188818e+17,https://twitter.com/GreenpeaceUK/status/704188320318881792
1218,Greenpeace UK,GreenpeaceUK,2016-02-24 11:49,38,18,70% of flights used by the richest 15% while it's the poorest who feel the worst effects of climate change. RT if you back # NoNewRunways,,,#,7.024301284339835e+17,https://twitter.com/GreenpeaceUK/status/702430128433983488
1219,Greenpeace UK,GreenpeaceUK,2016-02-24 11:39,25,13,Why the # Heathrow13 becoming the UK's first climate change protesters to go to prison would be 'deeply unjust': http://www.theguardian.com/environment/2016/feb/24/heathrow-13-likely-to-become-uks-first-climate-change-protesters-to-be-jailed …,,,#,7.024277059213804e+17,https://twitter.com/GreenpeaceUK/status/702427705921380356
1220,Greenpeace UK,GreenpeaceUK,2016-02-24 11:22,21,17,". @ CarolineLucas the real criminals today are not # Heathrow13 but those in power making the wrong decisions for our climate"" @ planestupid""",,@ @,#,7.024234392194908e+17,https://twitter.com/GreenpeaceUK/status/702423439219490820
1221,Greenpeace UK,GreenpeaceUK,2016-02-23 16:08,35,12,The UK could send a group of climate activists to jail tomorrow for the 1st time in 20 years > https://news.vice.com/article/the-uk-could-send-a-group-of-climate-change-activists-to-jail-today-for-the-first-time-in-20-years … # Heathrow13,,,#,7.021329607120732e+17,https://twitter.com/GreenpeaceUK/status/702132960712073216
