,username,user_handle,date,retweets,favorites,text,geological_location,mentions,hashtags,tweet_id,permalink
522,UN Climate Change,UNFCCC,2018-02-01 13:18,114,168,2018 is the year for # climateaction http://bit.ly/2E7S3oq We’re proud to co-host the first Global Climate Action Summit # GCAS2018 in California this year when business from around the world will step up commitments to # ParisAgreement and the # GlobalGoals. Video via @ WMBtweetspic.twitter.com/OA9quTUfn1,,@,# # # #,959023110392606720,https://twitter.com/UNFCCC/status/959023110392606720
523,UN Climate Change,UNFCCC,2018-01-27 12:01,127,146,". @ UN has opened Talanoa Dialogue portal, aiming for higher # climate ambition http://bit.ly/2FjixAj # Talanoa4Ambition is an international conversation in 2018, designed to check progress and help meet the goals of the # ParisAgreement on # ClimateAction # COP24pic.twitter.com/gEjQcbVYPz",,@,# # # # #,957191743673335808,https://twitter.com/UNFCCC/status/957191743673335808
524,UN Climate Change,UNFCCC,2018-01-26 12:44,64,90,500 companies to commit to science-based climate targets in line with # ParisAgreement goals http://bit.ly/2rHdcRr Initiative by Mahindra Group Chairman @ anandmahindra ahead of Global # ClimateAction Summit in Californiapic.twitter.com/FrRVB5prdv,,@,# #,956840266228469760,https://twitter.com/UNFCCC/status/956840266228469760
525,UN Climate Change,UNFCCC,2018-01-25 18:20,38,62,. @ UN partners with French startup to fight emissions from car traffic http://bit.ly/2nbqH7d @ wenow_official is working with the @ UN as part of our Climate Neutral Now Initiative # CNNowpic.twitter.com/MOWP4Y6VGe,,@ @ @,#,956562331747606528,https://twitter.com/UNFCCC/status/956562331747606528
526,UN Climate Change,UNFCCC,2018-01-24 17:55,119,142,What concrete measures must be taken by business and government leaders to accelerate the low-carbon transition? # Climate leaders and CEOs discuss next steps Thursday 10:00 a.m. CET. at the World Economic Forum. Watch the livestream: http://bit.ly/2F3WZI4 # WEF18 # StepUp2018pic.twitter.com/McnptxBAMp,,,# # #,956193733552328708,https://twitter.com/UNFCCC/status/956193733552328708
527,UN Climate Change,UNFCCC,2018-01-18 11:35,245,204,"Failure to reduce carbon emissions and build climate resilience, extreme weather events and natural disasters are among top global risks, says the latest @ wef Global Risks Report 2018 http://bit.ly/2mQggFZ # climatechange # risks18pic.twitter.com/B1dRDsR663",,@,# #,953923865859805184,https://twitter.com/UNFCCC/status/953923865859805184
528,UN Climate Change,UNFCCC,2018-01-17 18:48,117,99,"Coral reefs are crucial for food security, but are under threat due to # climatechange http://bit.ly/2Dr0nzC The 2018 International Year of the Reef began today in # Fiji with an appeal from Bonn @ UN Climate Change Conference President Frank Bainimarama # COP23 # IYOR2018pic.twitter.com/rzIcQ7d1aF",,@,# # # #,953670405172146176,https://twitter.com/UNFCCC/status/953670405172146176
529,UN Climate Change,UNFCCC,2018-01-14 19:44,177,195,The # ParisAgreement is being implemented. Explore how it is impacting your # business with the Climate Policy Tracker: http://climatepolicytracker.org (via @ WMBtweets)pic.twitter.com/EYt25xr4dH,,@,# #,952597185345945607,https://twitter.com/UNFCCC/status/952597185345945607
530,UN Climate Change,UNFCCC,2018-01-13 15:25,663,658,"White blanket of snow in the Sahara desert looked beautiful! But increasing frequency of snowfalls in the region is yet another sign of # climatechange, warns top Russian climate expert http://bit.ly/2mfNuNX (Photo credit: Karim Bouchetata/Geoff Robinson photgraphy)pic.twitter.com/mXnWw1garY",,,#,952169615613837312,https://twitter.com/UNFCCC/status/952169615613837312
531,UN Climate Change,UNFCCC,2018-01-12 11:39,87,106,The # ParisAgreement is being implemented. Explore how it is impacting your # business with the Climate Policy Tracker: http://climatepolicytracker.org (via @ WMBtweets)pic.twitter.com/xT2IH6dbfs,,@,# #,951750376193167361,https://twitter.com/UNFCCC/status/951750376193167361
532,UN Climate Change,UNFCCC,2018-01-11 18:03,100,154,China and France reaffirm commitment to joint climate action http://bit.ly/2Fq8FWr Agree to take concrete steps to push for the effective and timely implementation of the # ParisAgreementpic.twitter.com/Y7JoOCTARu,,,#,951484635975966721,https://twitter.com/UNFCCC/status/951484635975966721
533,UN Climate Change,UNFCCC,2018-01-11 12:14,483,512,"# Climatechange affects everyone, but it impacts the local communities and indigenous peoples the hardest. Our 2018 adaptation calendar highlights how these groups are also at the forefront of tackling the climate threat: http://unfccc.int/5854 pic.twitter.com/0x4DY62orV",,,#,951396903299813376,https://twitter.com/UNFCCC/status/951396903299813376
534,UN Climate Change,UNFCCC,2018-01-09 16:28,140,112,"Paris 1.5C goal crucial to protecting communities from rising seas, says new study http://bit.ly/2CUsA2d Urgent # ClimateAction needed to reduce carbon emissions and tackle climate change # ParisAgreementpic.twitter.com/sdhfEXj9yO",,,# #,950736011377639425,https://twitter.com/UNFCCC/status/950736011377639425
535,UN Climate Change,UNFCCC,2018-01-02 17:00,456,607,"Climate change is real and happening now, but affordable climate solutions exist. See how you can take action: http://bit.ly/1WMIBe4 # ClimateAction # GlobalGoals # ParisAgreementpic.twitter.com/4W5qThOWWc",,,# # #,948207398770151424,https://twitter.com/UNFCCC/status/948207398770151424
536,UN Climate Change,UNFCCC,2018-01-02 15:44,755,813,"Climate change is moving faster than we are . @ UN Secretary General @ antonioguterres's # NewYear message to world leaders: Narrow the gaps. Bridge the divides. Rebuild trust by bringing people together around common goals."" # ClimateAction # GlobalGoalspic.twitter.com/v08bYs1Lvu""",,@ @,# # #,948188212358459392,https://twitter.com/UNFCCC/status/948188212358459392
537,UN Climate Change,UNFCCC,2018-01-01 19:40,101,119,Graduate students - we’re looking for skilled communicators to help tell stories of climate action. Apply for an internship with @ Momentum_UNFCCC! http://bit.ly/2zkrzwR pic.twitter.com/uaR2YNOvyp,,@,,947885164323069953,https://twitter.com/UNFCCC/status/947885164323069953
538,UN Climate Change,UNFCCC,2017-12-30 12:05,81,126,It has been an exciting year for # ClimateTech! See what UNFCCC's technolgy committee has done to accelerate climate technology development and transfer here: http://bit.ly/tecact2017 pic.twitter.com/bFy9DvEsU1,,,#,947045849447747585,https://twitter.com/UNFCCC/status/947045849447747585
539,UN Climate Change,UNFCCC,2017-12-25 13:20,481,580,"Pollution decreased by 38% in areas of Barcelona which deployed # climate-friendly concepts, says our # COP23 partner @ DeutschePostDHL – a model for many other citiespic.twitter.com/Pz1gN4fy1H",,@,# #,945252794306510848,https://twitter.com/UNFCCC/status/945252794306510848
540,UN Climate Change,UNFCCC,2017-12-25 10:44,93,153,Today's # MotivationMonday comes from @ UN's Secretary General @ AntonioGuterres and his call for # ClimateAction during last month's Climate Conference # COP23 http://bit.ly/2A0bpKP pic.twitter.com/s9sU69sQAk,,@ @,# # #,945213530315227136,https://twitter.com/UNFCCC/status/945213530315227136
541,UN Climate Change,UNFCCC,2017-12-24 16:41,228,227,"The impacts of # ClimateChange are not just threats but an emerging reality. The 2017 Yearbook of Global Climate Action, presented at # COP23, provides an overview of how cities, regions, businesses and investors are working to implement the # ParisAgreement http://bit.ly/2z8AFhJ pic.twitter.com/9QJJQKm6KS",,,# # #,944940985426984960,https://twitter.com/UNFCCC/status/944940985426984960
542,UN Climate Change,UNFCCC,2017-12-12 13:50,346,420,"A revolution is underway! http://bit.ly/2B0zYaZ On the 2nd anniversary of the # ParisAgreement, the # OnePlanet Summit demonstrates how the financial system can be reset to achieve a stable # climate for our pic.twitter.com/kt4ENpSDCz",,,# # #,940549328627781632,https://twitter.com/UNFCCC/status/940549328627781632
543,UN Climate Change,UNFCCC,2017-12-12 10:45,62,92," # ParisAgreement and @ UNFCCC climate convention remain the only pathway to tackle # climatechange and this # OnePlanet Summit demonstrates how the financial system is aligning to the objectives of the agreement"" - @ UN Climate Chief @ PEspinosaCpic.twitter.com/Qj1lgtntxP""",,@ @ @,# # #,940502791499472896,https://twitter.com/UNFCCC/status/940502791499472896
544,UN Climate Change,UNFCCC,2017-12-11 14:53,62,92,"Monday is Climate Finance Day, a day ahead of # OnePlanet Summit in Paris http://bit.ly/2js7Nug See how Rabat Forum has worked to mobilize resources for climate resilient infrastructure # CFD2017 # GlobalGoals # ClimateActionpic.twitter.com/L0tp3c6p0B",,,# # # #,940202961250201600,https://twitter.com/UNFCCC/status/940202961250201600
545,UN Climate Change,UNFCCC,2017-12-08 09:40,74,111,"International Solar Alliance, launched at 2015 @ UN Climate Change Conference in Paris, enters into force: http://bit.ly/2Bcf74D # ParisAgreement # GlobalGoals # OnePlanetpic.twitter.com/21Jy7xxsnn",,@,# # #,939036882771443712,https://twitter.com/UNFCCC/status/939036882771443712
546,UN Climate Change,UNFCCC,2017-12-05 12:36,101,183,Happy # InternationalVolunteerDay! A special thank you to the 600+ # Volunteers who worked very hard to make the @ UN's Climate Change Conference in November successful. # COP23 wouldn't have been the same without you!pic.twitter.com/U3X27e2OOJ,,@,# # #,937993980121309184,https://twitter.com/UNFCCC/status/937993980121309184
547,UN Climate Change,UNFCCC,2017-11-27 22:55,101,128,"Soon coming to motorway filling stations in 18 European countries: Ultra-fast electric car chargers. The technology is there, but the transition to low carbon must happen faster and at greater scale for world to achieve # ParisAgreement climate goals. http://bit.ly/2BhU64s pic.twitter.com/d0Wy4w32jt",,,#,935250719480958976,https://twitter.com/UNFCCC/status/935250719480958976
548,UN Climate Change,UNFCCC,2017-11-26 22:30,244,316,"Just over a week ago, the @ UN Climate Conference # COP23 wrapped up in Germany, having produced many new climate action initiatives, commitments & partnerships: http://bit.ly/BonnCOP23 pic.twitter.com/WbmuXsbgCi",,@,#,934882162922479617,https://twitter.com/UNFCCC/status/934882162922479617
549,UN Climate Change,UNFCCC,2017-11-26 02:47,84,134,"During the @ UN # climate conference # COP23, Ashok Sridharan, Lord Mayor of Bonn, handed the Bonn-Fiji Commitment of Local & Regional Leaders to @ antonioguterres http://bit.ly/2yRHhkq Its aim: To deliver on the # ParisAgreement at all levelspic.twitter.com/YGQMKvBcU5",,@ @,# # #,934584369313992704,https://twitter.com/UNFCCC/status/934584369313992704
550,UN Climate Change,UNFCCC,2017-11-25 10:16,99,102,"At the @ UN climate Conference # COP23 which ended last week, UN and private sector leaders called for # BigData to be harnessed for # ClimateAction and # GlobalGoals http://bit.ly/2hLLaMI pic.twitter.com/i3F1lHLABg",,@,# # # #,934335004779393031,https://twitter.com/UNFCCC/status/934335004779393031
551,UN Climate Change,UNFCCC,2017-11-24 18:18,120,250,More than 650 volunteers helped make the November @ UN # climate conference # COP23 a success. We salute their hard work and commitment in the service of # ClimateAction and the # GlobalGoals @ UNVolunteerspic.twitter.com/WK3ALiZJdH,,@ @,# # # #,934093793170739200,https://twitter.com/UNFCCC/status/934093793170739200
552,UN Climate Change,UNFCCC,2017-11-23 15:06,53,78,Four major businesses from three different continents pledged to transition to electric transport by 2030 during the @ UN's Climate Conference. Read more about this and other concrete outcomes from # COP23 http://bit.ly/2iqdvZW pic.twitter.com/xxNnUHlQ3d,,@,#,933683071521394689,https://twitter.com/UNFCCC/status/933683071521394689
553,UN Climate Change,UNFCCC,2017-11-23 09:20,194,260,"The Ocean Pathway Partnership, launched at @ UN's Climate Conference # COP23, embodies the important relationship between # Oceans and # climatechange http://bit.ly/2iqdvZW pic.twitter.com/Im5A7epeRq",,@,# # #,933595994444283905,https://twitter.com/UNFCCC/status/933595994444283905
554,UN Climate Change,UNFCCC,2017-11-22 16:26,107,123,The @ UN's Climate Conference # COP23 featured new national and corporate # climateaction on forests http://bit.ly/2yxnXoq pic.twitter.com/DyR9aGXlAD,,@,# #,933340811084701696,https://twitter.com/UNFCCC/status/933340811084701696
555,UN Climate Change,UNFCCC,2017-11-22 11:23,110,118,"Inspired by the discussions at the @ UN's Climate Conference # COP23, @ UNSSCBonn put together a video on # ClimateAction and the # GlobalGoalspic.twitter.com/7gG8nYj4QF",,@ @,# # #,933264782563606528,https://twitter.com/UNFCCC/status/933264782563606528
556,UN Climate Change,UNFCCC,2017-11-21 09:37,139,168,Astronaut @ thom_astro was at the @ UN's # Climate Conference to talk about the # climatechange effects he's seen from space. Thanks Thomas and @ esa for your support! Read more about the outcomes from # COP23 http://bit.ly/2AQfaPn pic.twitter.com/UbNSlSDbGC,,@ @ @,# # #,932875496945102849,https://twitter.com/UNFCCC/status/932875496945102849
557,UN Climate Change,UNFCCC,2017-11-20 17:24,103,123,Some of the key moments from the 2017 UN Climate Change Conference caught on video. To learn more about the outcomes from # COP23 visit http://www.unfccc.int @ COP23pic.twitter.com/mP6n6xwOz7,,@,#,932630637047046144,https://twitter.com/UNFCCC/status/932630637047046144
558,UN Climate Change,UNFCCC,2017-11-20 13:11,948,1404,"During the @ UN's # Climate Conference # COP23, 12-year-old Timoci Naulusala from # Fiji reminded us that # ClimateAction has no age. Today we celebrate # WorldChildrensDay with his call to walk the talkpic.twitter.com/xADphBKQL9",,@,# # # # #,932566948939833344,https://twitter.com/UNFCCC/status/932566948939833344
559,UN Climate Change,UNFCCC,2017-11-18 08:54,632,597,"Bonn @ UN Climate Conference # COP23 becomes launch-pad for higher ambition http://bit.ly/2AQfaPn Momentum builds with new financial commitments on insurance and forests to scaled-up # ClimateAction by governments, cities and companiespic.twitter.com/DEjFDOLKcT",,@,# #,931777511633059840,https://twitter.com/UNFCCC/status/931777511633059840
560,UN Climate Change,UNFCCC,2017-11-18 01:33,90,122,It's a late night at @ UN climate conference # COP23 in Bonn as closing plenaries continue into the early hours of 18 November. Live webcast: http://bit.ly/2iqXz9O pic.twitter.com/kfsPPvXzl9,,@,#,931666641687121920,https://twitter.com/UNFCCC/status/931666641687121920
561,UN Climate Change,UNFCCC,2017-11-17 19:48,100,136,New wave of # ClimateAction announced at @ UN Climate Change Conference in Bonn # COP23 http://bit.ly/2j2pdcB Major initiatives include funds to support the poorest and most vulnerable # GlobalGoalspic.twitter.com/4FtbpS57W4,,@,# # #,931579858165125122,https://twitter.com/UNFCCC/status/931579858165125122
562,UN Climate Change,UNFCCC,2017-11-17 15:44,122,157,"We can't fight climate change with only 50 percent of the population"" http://bit.ly/1VNj8Az Celebrating Gender Day at # COP23pic.twitter.com/Pw7aE4GQo0""",,,#,931518301359898625,https://twitter.com/UNFCCC/status/931518301359898625
563,UN Climate Change,UNFCCC,2017-11-17 14:47,533,601,More than 20 countries launch global alliance to phase out # coal power http://bit.ly/2iqtVl4 Carbon pollution from coal is a leading contributor to climate change # COP23 # ClimateAction # GlobalGoalspic.twitter.com/x4AAqvhIzJ,,,# # # #,931504157634236416,https://twitter.com/UNFCCC/status/931504157634236416
564,UN Climate Change,UNFCCC,2017-11-16 19:02,69,110,"At @ UN # climate conference # COP23, major companies including @ Microsoft have made major # ClimateAction anouncements http://bit.ly/2yNOYUP pic.twitter.com/HFqMy7FCqW",,@ @,# # #,931205736490713090,https://twitter.com/UNFCCC/status/931205736490713090
565,UN Climate Change,UNFCCC,2017-11-16 16:00,170,146,"The impacts of climate change are not just threats but an emerging reality. The 2017 Yearbook of Global Climate Action provides an overview of how cities, regions, businesses and investors are working to implement the # ParisAgreement. Read more: http://bit.ly/2z8AFhJ # COP23pic.twitter.com/gA0DohkNet",,,# #,931159946346954752,https://twitter.com/UNFCCC/status/931159946346954752
566,UN Climate Change,UNFCCC,2017-11-16 09:42,117,193,Join us on Education Day at the @ UN Climate Conference # COP23 . Find the full schedule here: http://unfccc.int/10404 # ParisAgreement # GlobalGoalspic.twitter.com/kyO3kPUVV4,,@,# # #,931064889065508864,https://twitter.com/UNFCCC/status/931064889065508864
567,UN Climate Change,UNFCCC,2017-11-15 23:02,52,65,The 2017 Yearbook of Global Climate Action launched at the high-level closing of # ClimateAction events at # COP23 http://bit.ly/2yIDj9F Tracks progress towards building # resilience to climate change # GlobalGoalspic.twitter.com/5Xg1UhEWQM,,,# # # #,930903750469963776,https://twitter.com/UNFCCC/status/930903750469963776
568,UN Climate Change,UNFCCC,2017-11-15 16:02,117,130,. @ UN Secretary-General @ antonioguterres: “The catastrophic effects of # climatechange are upon us. The voice of small island states that are on the front lines of climate change must be the voice of us all” # COP23pic.twitter.com/mqk1In4o7R,,@ @,# #,930798155175747584,https://twitter.com/UNFCCC/status/930798155175747584
569,UN Climate Change,UNFCCC,2017-11-15 14:28,48,53,"We can raise climate ambition with circular economy strategies where things are made to last, repaired, remade, reused and recycled. # COP23 More info >> http://bit.ly/2ABXfwn Video stream >> http://bit.ly/2jprVwO pic.twitter.com/fcwwM7Sb41",,,#,930774404795117568,https://twitter.com/UNFCCC/status/930774404795117568
570,UN Climate Change,UNFCCC,2017-11-15 13:31,76,77,"Stay tuned for high-Level closing of Global Climate Action events at # COP23 http://bit.ly/2juovc1 At 18:00 CET today, with presentation of new Yearbook of global # ClimateAction (webcast live)pic.twitter.com/IDyXeDUXOx",,,# #,930760070954192901,https://twitter.com/UNFCCC/status/930760070954192901
571,UN Climate Change,UNFCCC,2017-11-15 10:02,83,93,"Global food security can only be achieved through a coordinated policy approach to hunger, poverty and climate change, world leaders and experts said at # COP23. Read more: http://bit.ly/2iVrM0a @ FAOnews @ FeedingIndiapic.twitter.com/lXhbg1CGJn",,@ @,#,930707462704873472,https://twitter.com/UNFCCC/status/930707462704873472
572,UN Climate Change,UNFCCC,2017-11-14 17:17,118,110,Global partnership launched at # COP23 to provide the poor & vulnerable with more protection against # climate risks http://bit.ly/2mooK9O Aim is to insure 400 million more people by 2020 # InsuResilience # GlobalGoals # climatechangepic.twitter.com/MUrzjrUKky,,,# # # # #,930454565945856001,https://twitter.com/UNFCCC/status/930454565945856001
573,UN Climate Change,UNFCCC,2017-11-13 18:22,112,178,. @ Schwarzenegger visited the UN Climate Change conference to show his support for accelerating climate action. # COP23 # ClimateAction @ COP23pic.twitter.com/7sgki1FVJQ,,@ @,# #,930108698281865216,https://twitter.com/UNFCCC/status/930108698281865216
574,UN Climate Change,UNFCCC,2017-11-13 17:04,82,171,"At @ UN climate conference # COP23 in Bonn, one of the best ways to get around is by zero emissions # climateplanet @ BMZ_Bundpic.twitter.com/d8Y9pNSEtk",,@ @,# #,930089006712356864,https://twitter.com/UNFCCC/status/930089006712356864
575,UN Climate Change,UNFCCC,2017-11-13 13:26,219,273,"Finance for # climate is flowing at a greater pace than ever, with growing markets for # renewable energy, electric vehicles and green buildings http://bit.ly/2iRhmyD More efforts needed to achieve # ParisAgreement goals # COP23 # GlobalGoals # ClimateActionpic.twitter.com/E7vSVBojTT",,,# # # # # #,930034038898855936,https://twitter.com/UNFCCC/status/930034038898855936
576,UN Climate Change,UNFCCC,2017-11-12 21:25,232,359,"UN Climate Change, @ WHO and the Fijian Presidency of @ COP23 launch a special initiative to protect people living in Small Island Developing States from the # health impacts of climate change http://bit.ly/2AB0Pqt # GlobalGoals # COP23pic.twitter.com/JzuZxqAVBJ",,@ @,# # #,929792245108236289,https://twitter.com/UNFCCC/status/929792245108236289
577,UN Climate Change,UNFCCC,2017-11-12 18:04,126,150,UN Climate Change and World Health Organization @ WHO team up to protect # health from climate change at # COP23 http://bit.ly/2yUjjW1 # GlobalGoals # ClimateActionpic.twitter.com/rxm51MMhXH,,@,# # # #,929741764688334848,https://twitter.com/UNFCCC/status/929741764688334848
578,UN Climate Change,UNFCCC,2017-11-12 16:50,242,279,"The only way to tackle # climatechange is for all nations to join hands with other nations. We need unity throughout. We are in the same canoe"" - # COP23 President @ FijiPM at end of first week of @ UN climate change conference in Bonn pic.twitter.com/fI6LGVsekq""",,@ @,# #,929722992627724293,https://twitter.com/UNFCCC/status/929722992627724293
579,UN Climate Change,UNFCCC,2017-11-12 16:45,127,163,"We are now in the early stages of a global sustainability revolution."" @ algore speaking at the UN Climate Change conference # COP23 # ClimateAction # ParisAgreementpic.twitter.com/yIHcdtEsMn""",,@,# # #,929721721770221568,https://twitter.com/UNFCCC/status/929721721770221568
580,UN Climate Change,UNFCCC,2017-11-12 11:30,50,87,"Inka & Fabian stopped in at # COP23 this week, after cycling 10,000 km across Europe to prove climate neutral travel is possible. Check out how you can reduce & offset your carbon emissions: http://climateneutralnow.org/ pic.twitter.com/UbtGAmoREn",,,#,929642447495294977,https://twitter.com/UNFCCC/status/929642447495294977
581,UN Climate Change,UNFCCC,2017-11-11 17:27,54,67,# Hack4Climate starts tomorrow! 100 hackers + # climate experts will meet to build innovative solutions to # ClimateChange http://bit.ly/2zreHWg # COP23 @ Hack_4_Climate pic.twitter.com/mdKaXLv3cP,,@,# # # #,929369881073483777,https://twitter.com/UNFCCC/status/929369881073483777
582,UN Climate Change,UNFCCC,2017-11-11 15:40,150,166,"Countries can significantly increase renewable energy ambition within Nationally Determined Contributions (NDCs), and accelerate its deployment in line with # climate objectives under the # ParisAgreement, says a new report by @ IRENA http://bit.ly/2i5BRIq # COP23pic.twitter.com/aDQhtGK6Rv",,@,# # #,929342960365441027,https://twitter.com/UNFCCC/status/929342960365441027
583,UN Climate Change,UNFCCC,2017-11-10 21:56,249,370,Scotland’s First Minister Nicola Sturgeon to address @ UN Climate Change Conference # COP23 on Wednesday 15 November http://bit.ly/2jhqtwm # GlobalGoalspic.twitter.com/rbd8tApXNE,,@,# #,929075312746549248,https://twitter.com/UNFCCC/status/929075312746549248
584,UN Climate Change,UNFCCC,2017-11-09 17:40,52,51,Deutsche Bank maps # climate risks to investments http://bit.ly/2zK1GrT Develops advance climate models to determine the vulnerability of business sites worldwide # ClimateAction # COP23pic.twitter.com/C6mqga0Nz8,,,# # #,928648392745586689,https://twitter.com/UNFCCC/status/928648392745586689
585,UN Climate Change,UNFCCC,2017-11-08 15:38,207,266,We all have a role to play in tackling climate change. Here's how some # COP23 attendees are reducing their footprint @ PEspinosaC @ COP23pic.twitter.com/V45WKLPo1Q,,@ @,#,928255293657571329,https://twitter.com/UNFCCC/status/928255293657571329
586,UN Climate Change,UNFCCC,2017-11-08 10:54,150,194,"320,000 tweets have already been posted with the hashtag # COP23 http://bit.ly/2Am9Pjh Follow the conversation on @ UN Climate Talks Live pic.twitter.com/uKtJ601USy",,@,#,928184024966881280,https://twitter.com/UNFCCC/status/928184024966881280
587,UN Climate Change,UNFCCC,2017-11-07 10:30,101,90,Follow the global conversation for # COP23 with @ UN Climate Talks Live's interactive dashboard http://bit.ly/2Am9Pjh @ COP23 @ bumbpic.twitter.com/ofJCOiMKcr,,@ @ @,#,927815409134219265,https://twitter.com/UNFCCC/status/927815409134219265
588,UN Climate Change,UNFCCC,2017-11-06 19:48,59,101,Bonn kids sang and acted for the planet at the @ UN climate conference # COP23 today: http://bit.ly/2hMR2Ww Read about it!pic.twitter.com/8JRySt8kes,,@,#,927593498676809728,https://twitter.com/UNFCCC/status/927593498676809728
589,UN Climate Change,UNFCCC,2017-11-06 11:46,126,154,. @ UN climate change conference # COP23 has officially opened. Live webcast can be seen here: http://bit.ly/2haaprL pic.twitter.com/rI1xbPQJi0,,@,#,927472353583517697,https://twitter.com/UNFCCC/status/927472353583517697
590,UN Climate Change,UNFCCC,2017-11-06 11:15,176,222,. @ UN climate change conference # COP23 about to start. Live webcast: http://bit.ly/2haaprL pic.twitter.com/SS9WHMbp1f,,@,#,927464338490908672,https://twitter.com/UNFCCC/status/927464338490908672
591,UN Climate Change,UNFCCC,2017-11-06 00:37,294,557,"The emoji for the @ UN Climate Change Conference # COP23 is there! Thanks @ Twitter for making this possible, & your support of # ClimateAction!pic.twitter.com/vRAPS8Ndgh",,@ @,# #,927303790310682625,https://twitter.com/UNFCCC/status/927303790310682625
592,UN Climate Change,UNFCCC,2017-11-05 22:40,322,341,The organizers of # COP23 have been preparing 12 months for the @ UN climate conference. Read what the COP is about: http://bit.ly/2hHu5nQ pic.twitter.com/hI3nxEkbjo,,@,#,927274481227313152,https://twitter.com/UNFCCC/status/927274481227313152
593,UN Climate Change,UNFCCC,2017-11-05 18:18,138,158,Farming and # forests action critical to climate and sustainability http://bit.ly/2iwtLbb A look at the sector ahead of # COP23pic.twitter.com/gcFIRvPL85,,,# #,927208579035254785,https://twitter.com/UNFCCC/status/927208579035254785
